<?xml version="1.0" encoding="utf-8" ?>
<fsm xmlns="urn:schema-lwj:fsm"
     xmlns:xsi="http://www.w3.org/2001/XMLSchema-instance"
      xsi:schemaLocation="urn:schema-lwj:fsm ../../../../resources/lwj.fsm.xsd"
     initial="s1">
  <state name="s1">
    <transition target="s2" event="to.s2" />
    <onEntry>
      <raise event="to.s2"/>
    </onEntry>
  </state>
  <state name="s2">
    <transition target="s3" event="to.s3"/>
    <onEntry>
      <raise event="to.s3"/>
    </onEntry>
  </state>
  <state name="s3" />
</fsm>