<?xml version="1.0" encoding="utf-8" ?>
<fsm xmlns="urn:schema-lwj:fsm"
     xmlns:x="urn:schema-lwj:expression"
     xmlns:xsi="http://www.w3.org/2001/XMLSchema-instance"
      xsi:schemaLocation="urn:schema-lwj:fsm ../../../resources/lwj.fsm.xsd
      urn:schema-lwj:expression ../../../resources/lwj.expr.xsd"
    initial="s1">
  <params>
    <param type="int32" name="i_0"  />
    <param type="int64" name="l_0"  />
    <param type="int32" name="i_1" value="1"  />
    <param type="int32" name="i_2"  >
      <x:int>2</x:int>
    </param>

    <param type="float32" name="f_0"  />
    <param type="float64" name="d_0"  />
    <param type="float32" name="f_01" value="0.1" />
    <param type="float32" name="f_02"  >
      <x:float>0.2</x:float>    
  </param>

    <param type="bool" name="b_false" />
    <param type="bool" name="b_true" value="true" />
    <param type="bool" name="b_false2" value="false" />
    <param type="bool" name="b_true2" >
      <x:bool>true</x:bool>
    </param>

    <param type="string" name="s_null"   />
    <param type="string" name="s_abc" value="abc"  />
    <param type="string" name="s_123"   >
      <x:string>123</x:string>    
  </param>

    <param type="type" name="t_null"   />
    <param type="type" name="t_string"  value="System.String"/>
    <param type="type" name="t_int">
      <x:type>System.Int32</x:type>    
  </param>

    <param type="datetime" name="datetime_value"  value="2017-01-02T03:04:05"/>
    <param type="datetime" name="datetime_expr">
      <x:datetime>2017-01-02T03:04:05</x:datetime>
    </param>

  </params>
  <state name="s1">
    <params>
      <param type="int32" name="ref_i_1">
        <x:var>i_1</x:var>      
    </param>
    </params>
  </state>
</fsm>