<?xml version="1.0" encoding="utf-8" ?>
<fsm xmlns="urn:schema-lwj:fsm"
     xmlns:x="urn:schema-lwj:expression"
     xmlns:xsi="http://www.w3.org/2001/XMLSchema-instance"
      xsi:schemaLocation="urn:schema-lwj:fsm ../../../../resources/lwj.fsm.xsd
         urn:schema-lwj:expression ../../../../resources/lwj.expr.xsd"
     initial="s1">
  <params>
    <param name="int32ByValue"  type="int32"/>
    <param name="stringByExpr"  type="string"/>
  </params>
  <state name="s1">
    <onEntry>
      <assign name="int32ByValue" value="1"></assign>
      <assign name="stringByExpr">
        <x:string>Hello World</x:string>
      </assign>
    </onEntry>
  </state>
</fsm>