<?xml version="1.0" encoding="utf-8" ?>
<fsm  xmlns="urn:schema-lwj:fsm"
     xmlns:xsi="http://www.w3.org/2001/XMLSchema-instance"
      xmlns:x="urn:schema-lwj:expression"
      xsi:schemaLocation="urn:schema-lwj:fsm ../../../resources/lwj.fsm.xsd 
      urn:schema-lwj:expression ../../../resources/lwj.expr.xsd"
    name="root" initial="s1" >
  <params>
    <param type="int32" name="n" value="2"/>
    <param type="string" name="trace"/>
  </params>
  <state name="s1">
    <transition target="s2">
      <cond>
        <x:geq>
          <x:postDecrement>
            <x:var>n</x:var>
          </x:postDecrement>
          <x:int>0</x:int>
        </x:geq>      
    </cond>
      <log msg="s1.transition"/>
    </transition>
    <onEntry>
      <log msg="s1.entry"/>
    </onEntry>
    <onExit>
      <log msg="s1.exit"/>
    </onExit>
  </state>
  <state name="s2">
    <transition target="s1">
      <log msg="s2.transition"/>
    </transition>
    <onEntry>
      <log msg="s2.entry"/>
    </onEntry>
    <onExit>
      <log msg="s2.exit"/>
    </onExit>
  </state>
</fsm>